{
  "id": "multitool",
  "name": {
    "fr": "Multitool",
    "en": "Multitool"
  },
  "description": {
    "fr": "L'outil desktop pour Star Citizen — traduction, cache, personnages, blueprints, actualités et mises à jour.",
    "en": "The desktop toolkit for Star Citizen — translation, cache, characters, blueprints, news and updates."
  },
  "branding": {
    "primaryColor": "#FAFAFA",
    "logo": "https://raw.githubusercontent.com/Onivoid/MultitoolV2/master/src-tauri/icons/128x128.png"
  },
  "repo": "https://github.com/Onivoid/MultitoolV2",
  "version": {
    "source": "github-releases",
    "repo": "Onivoid/MultitoolV2"
  },
  "download": {
    "windows-x86_64": {
      "asset": "Multitool-Installer.msi",
      "kind": "installer"
    }
  },
  "launch": {
    "windows": {
      "executable": "Multitool.exe",
      "candidates": [
        "%PROGRAMFILES%/Multitool/Multitool.exe",
        "%PROGRAMFILES%/Multitool/sandbox.exe",
        "%PROGRAMFILES(X86)%/Multitool/Multitool.exe",
        "%PROGRAMFILES(X86)%/Multitool/sandbox.exe",
        "%LOCALAPPDATA%/Programs/Multitool/Multitool.exe",
        "%LOCALAPPDATA%/Programs/Multitool/sandbox.exe",
        "%LOCALAPPDATA%/Multitool/Multitool.exe",
        "%LOCALAPPDATA%/Multitool/sandbox.exe"
      ]
    }
  }
}
